{"schema":"mr.summary/1","version":"2026-09-27T040000Z","side":"runner","restriction":"all","tier_group":"online","period":null,"previous_period":null,"baseline":{"decks":0,"games":0,"wins":0,"winrate":null,"entries_hc":0,"cut_hc":0,"cut_rate":null,"tournaments":0,"tournaments_hc":0,"games_all":0,"wins_all":0,"winrate_all":null},"cards":[],"risers":[],"fallers":[]}